1;"Donec ultricies";"Phasellus sollicitudin dolor et ante aliquet, quis convallis metus iaculis. Cras id libero erat. Fusce libero magna, dignissim ac nulla a, commodo bibendum justo. Ut ut mi ac est cursus vestibulum sed eget ligula. Fusce eget sem sit amet eros pretium pellentesque. Nulla sagittis egestas placerat. Donec congue dui pulvinar dui dictum egestas. Aliquam sed posuere sapien. Proin laoreet nisi quis dolor pharetra, ut congue mauris fermentum. ";"2";"2017-06-04"
2;"Nullam lobortis magna";"Nullam lobortis magna ac consequat elementum. Fusce vulputate, elit at tincidunt bibendum, enim sem rutrum tellus, sit amet faucibus urna risus nec libero. Sed pharetra dapibus ligula, eget finibus massa rutrum ac. Sed sit amet lacinia velit, ut scelerisque quam. Maecenas vel neque eros. Sed facilisis turpis ut pellentesque sodales. Donec tempor, turpis consequat dapibus euismod, enim erat facilisis nulla, nec egestas justo arcu vitae nulla. Etiam in erat non nibh consectetur tincidunt ut id nibh. Morbi porttitor ex augue, a laoreet enim volutpat nec.";"2";"2017-06-09"
3;"Etiam sit amet mi vulputate";"Etiam sit amet mi vulputate, tempor orci ut, dictum erat. Suspendisse eleifend porta urna, at eleifend urna porta et. Maecenas ac lobortis diam, consectetur eleifend orci. Sed id quam euismod, tempus leo quis, cursus velit. Orci varius natoque penatibus et magnis dis parturient montes, nascetur ridiculus mus. Vestibulum maximus sed ipsum et sollicitudin. Morbi malesuada odio id sollicitudin semper. Sed venenatis pharetra ipsum, a tincidunt mauris posuere et. Mauris aliquet quis ex et vestibulum.";"3";"2017-06-19"
4;"Aenean mattis nisl eu urna";"Aenean mattis nisl eu urna eleifend facilisis. Maecenas vel tellus vehicula, fermentum nulla id, accumsan neque. Pellentesque ultricies lobortis turpis, non luctus tellus mollis semper. Nam neque arcu, tempor nec mollis sed, finibus eu mi. Fusce at elit vestibulum, dignissim nisi molestie, tincidunt odio. Sed finibus sem in accumsan tincidunt. Praesent pellentesque lorem eu neque convallis venenatis et in magna.";"3";"2017-06-21"
5;"Sed sagittis cursus dictum.";"Sed sagittis cursus dictum. Nulla facilisi. Nullam est elit, tristique at libero et, consequat commodo nibh. Ut laoreet est in egestas rhoncus. Aliquam erat volutpat. Nullam id neque mauris. Aenean arcu risus, rhoncus et dapibus eu, commodo in ex. Fusce nec nibh non magna consectetur gravida. Morbi in justo vel lectus maximus ultrices. Etiam in turpis arcu. Integer ex nibh, dictum vel arcu at, sollicitudin scelerisque ante. ";"2";"2017-06-23"
6;"Aliquam erat volutpat.";"Aliquam erat volutpat. Fusce tincidunt rhoncus diam, sed aliquet sapien bibendum nec. Nulla libero libero, sagittis eget purus eget, luctus accumsan nisi. Aliquam cursus porta aliquam. Nunc tempus libero ac lectus vulputate, a rutrum ipsum dictum. Donec viverra erat nec pharetra interdum. Suspendisse cursus faucibus dolor, quis facilisis ligula dictum a. Vivamus dignissim nisi vehicula, auctor orci sed, consectetur mi. ";"2";"2017-07-02"
7;"Donec ultricies, purus";"Donec ultricies, purus id consectetur cursus, arcu nisi placerat ligula, quis maximus est risus a justo. Fusce consectetur dolor ut cursus luctus. Suspendisse dictum urna eget neque fringilla, ac venenatis purus consectetur. Morbi vulputate felis sit amet elit gravida, in convallis lectus consectetur. Vestibulum et ligula purus. Aliquam venenatis sem quis ipsum consectetur, ut tincidunt velit semper. Duis accumsan odio nec arcu facilisis porttitor. Suspendisse vulputate dignissim lacus, ac posuere orci consequat quis. Phasellus auctor, lorem vitae dictum eleifend, neque massa vehicula lacus, sed iaculis libero erat quis eros.";"3";"2017-07-04"
8;"Ut nec faucibus lorem.";"Ut nec faucibus lorem. Nullam vitae augue ipsum. Curabitur tempus leo vel enim dictum lacinia. In suscipit gravida mi eu fermentum. Phasellus et varius nunc. Etiam sed ipsum sit amet nulla aliquam maximus sed id leo. Nam id venenatis augue. Proin aliquam turpis ac lacus interdum, id gravida mi scelerisque. Fusce sed scelerisque nisi. Phasellus tincidunt nulla a nunc fermentum, eu aliquet urna tincidunt.";"2";"2017-07-07"
9;"Orci varius natoque penatibus";"Orci varius natoque penatibus et magnis dis parturient montes, nascetur ridiculus mus. Nulla in dui arcu. Vivamus non feugiat ante. Cras tristique lacinia sapien, vel tincidunt felis suscipit a. Morbi quis elit felis. Ut in dictum ligula. Aenean tincidunt massa mauris, sit amet eleifend risus commodo nec. Duis porttitor elit quis urna vulputate, vel euismod nisl interdum. Integer pharetra posuere elit eget fermentum. In nec dapibus diam. Ut ac tortor nulla.";"2";"2017-07-09"
